{
  "schema_version": "1.0",
  "campaign_id": "p0-export-correctness",
  "batch_id": "p0-batch-a",
  "created_at": "2026-09-17T00:00:00Z",
  "document": {
    "expected_title": "KSRF_Hosp_Interior_AR_V03_33 MB_2025-02-03"
  },
  "execution_policy": {
    "max_jobs_per_run": 100,
    "on_job_error": "continue",
    "resume": true
  },
  "jobs": [
    {
      "job_id": "p0-select",
      "probe_id": "stage_a_p0_export_correctness",
      "view": {
        "element_id": 528698,
        "name": "MOB 1 - LEVEL 2"
      },
      "settings": {
        "selection": "p0_select"
      },
      "output_directory": "captures/p0-select"
    },
    {
      "job_id": "p0-default-mob-1",
      "probe_id": "stage_a_p0_export_correctness",
      "view": {
        "element_id": 528698,
        "name": "MOB 1 - LEVEL 2"
      },
      "settings": {
        "selection": "p0_default",
        "disable_underlay": true
      },
      "output_directory": "captures/p0-default-mob-1"
    },
    {
      "job_id": "p0-override-mob-1",
      "probe_id": "stage_a_p0_export_correctness",
      "view": {
        "element_id": 528698,
        "name": "MOB 1 - LEVEL 2"
      },
      "settings": {
        "selection": "p0_override",
        "disable_underlay": true,
        "cap_axis_px": 15000
      },
      "output_directory": "captures/p0-override-mob-1"
    }
  ]
}
