{
  "schema_version": "1.0",
  "campaign_id": "p0-export-correctness",
  "batch_id": "p0-batch-b",
  "created_at": "2026-09-17T00:00:00Z",
  "document": {
    "expected_title": "KSRF_Hosp_Interior_AR_V03_33 MB_2025-02-03"
  },
  "execution_policy": {
    "max_jobs_per_run": 100,
    "on_job_error": "continue",
    "resume": true
  },
  "jobs": [
    {
      "job_id": "p0-derived",
      "probe_id": "stage_a_p0_export_correctness",
      "view": {
        "element_id": 0,
        "name": "REPLACE FROM p0-select derived_job_candidates"
      },
      "settings": {
        "selection": "p0_derived",
        "disable_underlay": true
      },
      "output_directory": "captures/p0-derived"
    }
  ]
}
